CNPq_ID,Name,Institution,Area,City,State,Country,Lattes_URL,Search_Term,Created_At
K4302585Z7,Victor Borges Ferreira Gomes,University of Sheffield,,,,,http://lattes.cnpq.br/K4302585Z7,program verification,2025-05-27 02:41:40
K4414716P6,Vinícius Pereira,Universidade de São Paulo,,,,,http://lattes.cnpq.br/K4414716P6,"formal methods, formal verification, formal semantics",2025-05-27 02:41:22
K8183619P3,Viorel Milea,Erasmus University Rotterdam,,,,,http://lattes.cnpq.br/K8183619P3,automated reasoning,2025-05-27 02:41:47
K4799291P4,Virginia Carvalho Carneiro de Paula,Universidade Federal de Pernambuco,,,,,http://lattes.cnpq.br/K4799291P4,linguagens de especificação,2025-05-27 02:41:45
K4816497D2,Vitor Pereira Machado,Universidade Federal do Rio de Janeiro,,,,,http://lattes.cnpq.br/K4816497D2,temporal logic,2025-05-27 02:41:33
K4434715J1,Vivek Nigam,,,,,,http://lattes.cnpq.br/K4434715J1,automated reasoning,2025-05-27 02:41:47
K4202499H6,Wilerson Venceslau Calil,Universidade de São Paulo,,,,,http://lattes.cnpq.br/K4202499H6,program verification,2025-05-27 02:41:41
K8703868E0,Yeison Andres Zabala,Universidade de São Paulo,,,,,http://lattes.cnpq.br/K8703868E0,static analysis,2025-05-27 02:41:39
K1797246Y9,Ângelo Antônio dos Anjos Dias,,,,,,http://lattes.cnpq.br/K1797246Y9,linguagens de especificação,2025-05-27 02:41:45
K4339024P6,Óscar Emanuel Chaves Mealha,Universidade de Aveiro,,,,,http://lattes.cnpq.br/K4339024P6,computacao,2025-05-27 02:25:47
